{
  "schema_version": "1.0.0",
  "record_type": "coverage_status_export",
  "id": "latest-coverage-status",
  "generated_at": "2026-06-28T17:20:20.380Z",
  "record_counts": {
    "coverage_assessments": 2,
    "current_coverage_assessments": 1,
    "superseded_coverage_assessments": 1
  },
  "items": [
    {
      "coverage_assessment_id": "senolytics-coverage-repair-2026-06-21",
      "name": "Senolytics coverage repair assessment",
      "track_id": "senolytics",
      "hallmark_id": "cellular_senescence",
      "assessment_type": "coverage_repair",
      "assessed_at": "2026-06-27T18:13:25Z",
      "coverage_verdict": "adequate",
      "coverage_confidence": "moderate",
      "coverage_scope": "vertical_slice",
      "maturity_status": "triage_summary",
      "is_current": true,
      "summary": "The senolytics track has an auditable vertical slice across preclinical D+Q discovery/healthspan evidence, early human biomarker and pilot human studies, a phase 2 randomized bone trial, a 2025 cognition/mobility pilot, translation-review context, risk-of-bias records, and registry-only active trial-watch records. DKD and AD-risk human records now include PubMed abstract-located sample, dosing, timepoint, and effect details, and IPF has an abstract-located dosing-completion result plus corrected RCT sample size. These upgrades remain below source-snapshot-backed extraction grade, and the D+Q bone publication-table and supplement reconciliation remains incomplete.",
      "evidence_categories": [
        {
          "category": "human_interventional",
          "coverage_level": "adequate",
          "rationale": "Includes early D+Q human biomarker, randomized IPF pilot, phase 2 bone, and AD-risk cognition/mobility pilot records; DKD, IPF, and AD-risk now have at least abstract-located extraction for sample, dosing, timing, or effect details.",
          "source_ids": [
            "pmid-31542391",
            "pmid-36857968",
            "pmid-38956196",
            "pmid-40010154"
          ],
          "finding_ids": [
            "dq-dkd-human-senescent-cell-biomarker-signal",
            "dq-ipf-randomized-feasibility-tolerability-mixed",
            "dq-bone-rct-primary-null-subgroup-biomarker-signal",
            "dq-ad-risk-pilot-cognition-mobility-signal"
          ]
        },
        {
          "category": "animal_lifespan_or_healthspan",
          "coverage_level": "adequate",
          "rationale": "Includes foundational discovery work plus the old-mouse healthspan and post-treatment survival paper.",
          "source_ids": [
            "pmid-25754370",
            "pmid-29988130"
          ],
          "finding_ids": [
            "dq-senolytic-drug-discovery-preclinical",
            "dq-old-mice-healthspan-lifespan-positive"
          ]
        },
        {
          "category": "mechanistic",
          "coverage_level": "adequate",
          "rationale": "Cellular senescence targeting is anchored by the discovery source and translation review, but pathway-level extraction is not yet complete.",
          "source_ids": [
            "pmid-25754370",
            "pmid-32686219"
          ],
          "finding_ids": [
            "dq-senolytic-drug-discovery-preclinical",
            "senolytic-translation-review-boundary"
          ],
          "gap_note": "Future extraction should separate senescent-cell survival pathways, SASP markers, and tissue-specific clearance evidence."
        },
        {
          "category": "null_negative_or_limiting",
          "coverage_level": "adequate",
          "rationale": "The IPF, bone, and AD-risk records explicitly encode mixed, pilot, primary/subgroup, and feasibility limitations instead of flattening them into positive claims; the AD-risk record now includes the abstract-level MoCA and TNF-alpha estimates.",
          "source_ids": [
            "pmid-36857968",
            "pmid-38956196",
            "pmid-40010154"
          ],
          "finding_ids": [
            "dq-ipf-randomized-feasibility-tolerability-mixed",
            "dq-bone-rct-primary-null-subgroup-biomarker-signal",
            "dq-ad-risk-pilot-cognition-mobility-signal"
          ]
        },
        {
          "category": "safety_durability",
          "coverage_level": "thin",
          "rationale": "Safety-oriented records now include the D+Q bone registry aggregate counts, full-text adverse-event table extraction, an accepted structured headache preferred-term row, and retained locators for withdrawal, dosing cadence, and durability context. The remaining publication table rows, discontinuation details, and the DKD/IPF/AD-risk human safety slices still need row-level or source-specific extraction before safety synthesis.",
          "source_ids": [
            "pmid-38956196",
            "nct-04313634",
            "pmid-36857968",
            "pmid-40010154",
            "pmid-32686219"
          ],
          "finding_ids": [
            "dq-bone-rct-primary-null-subgroup-biomarker-signal",
            "dq-ipf-randomized-feasibility-tolerability-mixed",
            "dq-ad-risk-pilot-cognition-mobility-signal",
            "senolytic-translation-review-boundary"
          ],
          "gap_note": "Run bounded extraction for the remaining D+Q bone adverse-event rows and discontinuation counts, then ingest or retain source snapshots for DKD, IPF, and AD-risk safety extraction before attempting cross-human safety synthesis."
        },
        {
          "category": "active_trials_registries",
          "coverage_level": "thin",
          "rationale": "Two active no-results trial-watch records were added, but the full senolytics registry surface still needs a broader surveillance pass.",
          "source_ids": [
            "nct-06133634",
            "nct-04685590"
          ],
          "finding_ids": [
            "fisetin-vascular-active-no-posted-results",
            "dq-stomp-ad-active-no-posted-results"
          ],
          "gap_note": "Add deferred fisetin frailty registries and associated no-results status records in the next surveillance pass."
        },
        {
          "category": "recent_reviews_meta_analyses",
          "coverage_level": "thin",
          "rationale": "The current slice includes a narrative translation review but no systematic-review or meta-analysis record.",
          "source_ids": [
            "pmid-32686219"
          ],
          "finding_ids": [
            "senolytic-translation-review-boundary"
          ],
          "gap_note": "Search specifically for recent systematic reviews, trial reviews, and evidence maps."
        },
        {
          "category": "taxonomy_boundary",
          "coverage_level": "adequate",
          "rationale": "Records separate senolytic mechanism/intervention class from evidence tier, clinical indication, and registry status, reducing the risk that the track becomes an unsupported efficacy bucket.",
          "source_ids": [
            "pmid-32686219",
            "nct-06133634",
            "nct-04685590"
          ],
          "finding_ids": [
            "senolytic-translation-review-boundary",
            "fisetin-vascular-active-no-posted-results",
            "dq-stomp-ad-active-no-posted-results"
          ]
        }
      ],
      "covered_source_ids": [
        "pmid-25754370",
        "pmid-29988130",
        "pmid-31542391",
        "pmid-36857968",
        "pmid-38956196",
        "pmid-40010154",
        "pmid-32686219",
        "nct-06133634",
        "nct-04685590"
      ],
      "covered_finding_ids": [
        "dq-senolytic-drug-discovery-preclinical",
        "dq-old-mice-healthspan-lifespan-positive",
        "dq-dkd-human-senescent-cell-biomarker-signal",
        "dq-ipf-randomized-feasibility-tolerability-mixed",
        "dq-bone-rct-primary-null-subgroup-biomarker-signal",
        "dq-ad-risk-pilot-cognition-mobility-signal",
        "senolytic-translation-review-boundary",
        "fisetin-vascular-active-no-posted-results",
        "dq-stomp-ad-active-no-posted-results"
      ],
      "known_gaps": [
        {
          "gap_id": "senolytics-exact-effect-extraction",
          "gap_type": "operational_gap",
          "category": "human_interventional",
          "description": "DKD and AD-risk human studies now have PubMed abstract-located sample, dosing, timepoint, and effect details, and IPF has an abstract-located dosing-completion result plus corrected randomized-pilot sample size. However, durable source snapshots could not be created in this worker, the legacy IPF generic outcome/result still needs reconciliation, and the D+Q bone RCT still needs full publication table and supplement reconciliation.",
          "priority": "high",
          "suggested_action": "Create or refresh durable PubMed/PMC source snapshots for DKD, IPF, and AD-risk, complete full-text/table extraction where needed, and reconcile the bone RCT registry extraction against full article tables and supplements."
        },
        {
          "gap_id": "senolytics-safety-tables",
          "gap_type": "coverage_gap",
          "category": "safety_durability",
          "description": "Aggregate adverse-event counts and the D+Q bone headache preferred-term row have been extracted for the D+Q bone RCT, and retained full-text locators now identify the safety table, withdrawal narrative, dosing cadence, and durability discussion. Event-specific structured rows beyond headache, discontinuation count fields, and source-snapshot-backed safety extraction for the DKD, IPF, and AD-risk human studies remain incomplete.",
          "priority": "high",
          "suggested_action": "Run table-row extraction context packs for the remaining D+Q bone adverse-event terms and withdrawals, then ingest or retain appropriate source snapshots before extending safety extraction across DKD, IPF, and AD-risk studies."
        },
        {
          "gap_id": "senolytics-registry-surveillance-breadth",